Conversation,Date
Long term investors should not worry! Buy now so you don't regret later,2024-10-03
@Madoka YOLO.  Do it now you won't be able to afford it later.,2024-09-19
@pakrolltide You get more CCs obviously.I think my total credit availability is 81k.  That's a lot of money I could spend frivolously if I really wanted to tank my financial security.,2024-09-19
Nothing to do with The Fed....It's the HOLIDAZE Craze...most predictable.,2024-09-19
"So if you have nothing in your checking account and your credit cards are maxed, how do you go to these places?",2024-09-19
