Conversation,Date
B of A says BUY BUY PLTR......load up before it rockets higher.,2024-09-17
"Palantir has established itself as the leading AI SAAS. Not only is its AIP adding value to businesses for its clients, it is even surpassing expectations. Companies are cutting costs, streamlining operations and effectively making more money.",2024-09-17
I sold Nvidia and SMCI way too early because people said they were over-valued. I am not making the same mistake with PLTR. HODLing with diamond hands.,2024-09-17
I loaded up this morning when I saw this.....PLTR $ 37.00 which is now the bottom.Every day we go higher and higher.BUY,2024-09-17
"Rule #1 of investing - never invest in any corporation that derives its income solely from California. All profits end up going to the shake-down race-obsessed Dem government through news taxes, fees and assessments",2024-09-13
